{"authorization_id":"PENDING_FREEZE","authorization_sha256":"dc988c4a0c338031357661d0946f0235db13980009aa657591b06aa1467826e0","authorization_window":"PENDING_FREEZE","baseline":{"ci_attempt":1,"ci_conclusion":"success","ci_run_id":30451250259,"master_sha":"4af4b2756e8d2de6764d08e17a6e12040e24975e","phase11b_acceptance_report_sha256":"354398234ee34773f26b1811ece62a5ccc7ed9fd18472adb11e1907bec25c6f7","phase11b_acceptance_status":"accepted","phase11b_authorization_sha256":"73c8367ce00ce4ad77798dbd1bcbf0f3995528096b18924f2a198ba290796745","phase11b_runtime_config_sha256":"e1a3d3adadc78ab0b11e8d28b60ba05552c503edf7b91661e895d24cb5ea8bdc"},"binding_state":"pending_freeze","gate":"gate_b","gate_b_bindings":{"aliyun_runtime_identity_sha256":"PENDING_FREEZE","executable_code_commit_sha":"PENDING_FREEZE","executable_source_tree_sha256":"PENDING_FREEZE","immutable_image_digest":"PENDING_FREEZE","preflight_verdict_sha256":"PENDING_FREEZE","provider_tariff_manifest_sha256":"PENDING_FREEZE","rendered_deployment_config_sha256":"PENDING_FREEZE","runtime_config_sha256":"PENDING_FREEZE","source_archive_sha256":"PENDING_FREEZE","synthetic_cohort_manifest_sha256":"PENDING_FREEZE"},"human_approvals":{"diagnostic":"PENDING_EXPLICIT_APPROVAL","headline_cohort":"PENDING_EXPLICIT_APPROVAL"},"owners":"PENDING_FREEZE","paid_calls_enabled":false,"phase_id":"phase11c-provider-canary-v1","real_provider_calls_enabled":false,"schema_version":"phase11c-provider-canary-authorization/v1"}
